word,pos,difficulty,theme,synonyms,definition_en,example_sentence
publication,noun,3,Library Science,"journal, periodical","A book, journal, or other piece of writing that is made available to the public, either in print or electronically.",The university's new policy encourages faculty to submit their research to open-access publications to ensure wider dissemination of knowledge.
relevant,adjective,3,Sociology,"pertinent, applicable",Closely connected or appropriate to what is being done or considered.,"In sociological research, it is crucial to gather data that is directly relevant to the hypothesis being tested, as extraneous information can obscure the underlying patterns of social behavior."
reveal,verb,3,Archaeology,"disclose, uncover","To make known or show something that was previously secret, hidden, or unknown.",The meticulous excavation of the site is expected to reveal critical details about the daily life and rituals of the pre-Columbian civilization.
exclude,verb,3,Sociology,"omit, leave out","To intentionally not include something or someone in a group, activity, or consideration.","The study's methodology was criticized for its decision to exclude participants over the age of 65, which could limit the generalizability of the findings."
cite,verb,3,Law,"quote, reference","To quote or mention a passage, book, or author as evidence for or justification of an argument or statement, especially in a scholarly work.","In her legal brief, the attorney was required to cite several precedents from appellate court decisions to substantiate her argument."
authority,noun,3,Political Science,"jurisdiction, command","The power or right to give orders, make decisions, and enforce obedience; also, a person or organization having power or control in a particular, typically political or administrative, sphere.","In political philosophy, the concept of legitimate authority is central to understanding the relationship between the state and its citizens, questioning the basis on which a government can rightfully exercise power over its people."
global,adjective,3,Economics,"worldwide, international","Relating to or encompassing the whole of something, especially the entire world.",The shift towards a global economy has been characterized by the rapid integration of financial markets and the expansion of multinational corporations across continents.
consumption,noun,3,Economics,"utilization, expenditure","The act of using up a resource, or the amount of something that is used, eaten, or bought.","The theory of conspicuous consumption suggests that individuals purchase certain goods to display their wealth and social status, rather than for their intrinsic utility."
investigate,verb,3,Criminology,"examine, probe","To carry out a formal or systematic inquiry to discover and examine the facts of an incident, allegation, or subject so as to establish the truth.","The special committee was tasked to investigate the allegations of corruption within the government agency, a process that required meticulous review of financial records."
interpret,verb,3,Linguistics,"construe, explain","To explain or understand the meaning of information, words, or actions in a particular way.",Analysts may be required to interpret complex datasets and communicate their findings to a non-technical audience.
participate,verb,3,Sociology,"engage, take part","To take part in or become involved in an activity, event, or process.",The longitudinal study required subjects to actively participate in a series of social experiments over a five-year period to measure changes in group dynamics.
threat,noun,3,Ecology,"menace, danger",A person or thing likely to cause damage or danger; a declaration of an intention to inflict harm.,"Habitat fragmentation is considered a major threat to biodiversity, as it can lead to smaller, more isolated populations that are more vulnerable to extinction."
environment,noun,3,Ecology,"surroundings, milieu","The surroundings or conditions in which a person, animal, or plant lives or operates; it can also refer to the natural world as a whole, especially as affected by human activity.","The physical environment, which includes factors like temperature, water availability, and soil composition, directly influences the distribution and abundance of organisms within an ecosystem."
verify,verb,3,Computer Science,"confirm, substantiate","To make sure or demonstrate that something is true, accurate, or justified.","Before processing the transaction, the cryptographic protocol must verify the integrity of the data packet to prevent unauthorized modifications."
commit,verb,3,Sociology,"perpetrate, dedicate","To carry out or perpetrate (a mistake, crime, or immoral act); to pledge or bind (a person or an organization) to a certain course or policy.","Many developing nations commit a significant portion of their national budget to education, viewing it as a long-term investment in human capital."
essential,adjective,3,Biology,"crucial, vital",Absolutely necessary or extremely important; fundamental to the nature of something.,"Water is essential for all known forms of life, acting as a solvent in which many of the cell's metabolic reactions occur."
diversity,noun,3,Sociology,"variety, multiplicity","The condition of having or being composed of differing elements or qualities; the inclusion of different types of people, such as those of different races or cultures, in a group or organization.","The resilience of an ecosystem is often directly correlated with its biological diversity, as a greater variety of species can better withstand environmental stressors."
production,noun,3,Economics,"manufacturing, creation",The process of creating or manufacturing goods and commodities from raw materials or components.,"The efficient allocation of land, labor, and capital is crucial for maximizing economic production and achieving sustainable growth."
fundamental,adjective,3,Physics,"essential, basic",Forming a necessary base or core; of central importance.,"The conservation of energy is a fundamental principle of physics, stating that the total energy of an isolated system remains constant over time."
particularly,adverb,3,Environmental Science,"especially, specifically",To a higher degree than is usual or average; used to single out a subject to which a statement is especially applicable.,"The impact of climate change is felt globally, but it is particularly devastating for low-lying coastal regions, which face the dual threats of rising sea levels and increased storm intensity."
recommend,verb,3,Education,"suggest, advise",To put forward someone or something with approval as being suitable for a particular purpose or role; to advise a course of action.,"Based on a comprehensive review of pedagogical literature, the curriculum committee recommends integrating project-based learning modules to enhance student engagement and critical thinking skills."
acquire,verb,3,Linguistics,"obtain, gain","To get or obtain something, such as a skill, knowledge, or a physical object, often through effort or experience.","The critical period hypothesis posits that the ability to acquire a language is biologically linked to age, with a significant decline in proficiency for learners after puberty."
degree,noun,3,Education,"qualification, diploma","An academic rank conferred by a college or university after successful completion of a course of study; it can also refer to a unit of measurement or the extent, level, or scope of something.",Earning a postgraduate degree in computational linguistics often requires a sophisticated understanding of both theoretical models and practical programming applications.
climate,noun,3,Geography,"clime, milieu","The long-term pattern of weather in a particular area, or the general attitude, mood, or conditions existing in a particular place or situation.","Paleoclimatology is the study of past climate over a great period of the Earth's history, and ancient climate can be reconstructed by looking at the geological record."
management,noun,3,Business Studies,"administration, supervision",The process of dealing with or controlling things or people; the group of people responsible for controlling and organizing a company or institution.,"The study of organizational behavior provides critical insights into the management of human resources, highlighting the psychological factors that influence productivity and team dynamics."
address,verb,3,Sociology,"tackle, deal with",To think about and begin to deal with an issue or problem.,"The research aims to address the multifaceted issue of social inequality by examining the interplay of economic, educational, and political factors."
overall,adjective,3,Sociology,"general, comprehensive",Taking everything into account; including all the parts or aspects of something; general or total.,"The overall trend in post-industrial societies is a shift from manufacturing-based economies to ones centered on information, services, and technology."
compromise,verb,3,Political Science,"concede, undermine","To settle a dispute by mutual concession; to accept standards that are lower than is desirable for practical reasons, potentially weakening or damaging the integrity of something.","During the constitutional convention, the delegates had to compromise on the issue of state representation to ensure the ratification of the new framework."
enable,verb,3,Technology,"permit, allow",To give someone or something the authority or means to do something; to make something possible.,The modular architecture of the software framework enables developers to integrate custom functionalities without altering the core code.
competition,noun,3,Biology,"rivalry, contention","A situation in which two or more individuals, groups, or organisms strive for a common goal which cannot be shared, or for resources that are in limited supply.",Ecological models demonstrate that intense interspecific competition for a limited resource can lead to the competitive exclusion of one species by another.
evidence,noun,3,Law,"proof, confirmation",The available body of facts or information indicating whether a belief or proposition is true or valid.,"Archaeological evidence from the excavation site, including pottery shards and carbon-dated organic matter, provided compelling support for the theory of an early agricultural settlement."
predict,verb,3,Meteorology,"forecast, foretell","To say or estimate that a specified thing will happen in the future or will be a consequence of something, often based on evidence or a particular method.","By analyzing historical climate data and current atmospheric conditions, climatologists can predict long-term environmental shifts with a reasonable degree of confidence."
source,noun,3,History,"origin, provenance","A place, person, or thing from which something originates or can be obtained.","The collaborative nature of open-source software allows programmers worldwide to access and modify the original source code, fostering rapid innovation and transparency."
sample,noun,3,Statistics,"specimen, example","A small part or quantity of something, intended to be representative of the whole, that is taken for analysis, testing, or demonstration.","To ensure the results were generalizable to the entire student body, the researchers selected a random sample of 500 individuals from the university's enrollment records."
responsibility,noun,3,Sociology,"accountability, duty",The state or fact of having a duty to deal with something or of having control over someone; the state or fact of being accountable or to blame for something.,"In sociological terms, civic responsibility extends beyond mere legal compliance to include active participation in community life and a commitment to the collective well-being."
principle,noun,3,Philosophy,"doctrine, tenet",A fundamental truth or proposition that serves as the foundation for a system of belief or behavior or for a chain of reasoning.,"The principle of parsimony, often associated with Ockham's razor, suggests that when presented with competing hypothetical answers to a problem, one should select the one that makes the fewest assumptions."
democracy,noun,3,Political Science,"republic, self-government","A system of government by the whole population or all the eligible members of a state, typically through elected representatives.","The transition from authoritarian rule to a functioning democracy is a complex process, often fraught with institutional challenges and the risk of political instability."
approach,noun,3,Sociology,"method, strategy","A way of dealing with a situation or problem; a particular method or procedure for accomplishing a task or achieving a goal, especially within an academic or professional context.","The ethnographic approach allows researchers to immerse themselves in a community, providing a rich, qualitative understanding of social dynamics that quantitative methods might miss."
conclusion,noun,3,Philosophy,"inference, deduction","A judgment or decision reached by reasoning, based on the information available.","In formal logic, a valid argument is one where the conclusion necessarily follows from the premises, regardless of whether the premises themselves are true."
adopt,verb,3,Sociology,"embrace, assume","To accept or start to use something new, such as an idea, a plan, or a style; or to legally take someone else's child into your own family and raise them as your own.","As digital literacy rates increased, many developing nations began to adopt mobile banking technologies to foster financial inclusion among previously unbanked populations."
accurate,adjective,3,Statistics,"precise, exact","Correct in all details; conforming exactly to a standard, fact, or truth; free from error.","For the statistical model to be useful in predicting future trends, it must be based on accurate historical data that is free from significant bias."
scale,noun/verb,3,Geography,"magnitude, proportion","A relative size, extent, or magnitude; a standard of measurement or a ratio between the size of something real and its representation.","Cartographers must carefully select the appropriate scale for a map, as it dictates the balance between the extent of the area shown and the level of detail that can be included."
appeal,verb,3,Sociology,"attract, entice","To make a serious or earnest request, typically to a higher authority; or, to be attractive or interesting to someone.","For a social movement to gain widespread traction, its core message must appeal to the fundamental values and pre-existing grievances of a significant portion of the population."
reflect,verb,3,Sociology,"indicate, demonstrate","To show, express, or be a sign of a particular situation, idea, or feeling; to think deeply or carefully about something.",The study's findings reflect a significant shift in public opinion regarding environmental policies over the past decade.
opportunity,noun,3,Sociology,"chance, prospect",A time or set of circumstances that makes it possible to do something.,"The study of post-war reconstruction offers a unique opportunity to analyze the complex interplay between international aid, national policy, and local community resilience."
generate,verb,3,Physics,"produce, create","To cause something to exist or come about; to produce or create, especially in a scientific, technical, or economic context.","In particle physics, high-energy collisions are engineered to generate a cascade of exotic subatomic particles, which are then meticulously analyzed to probe the fundamental laws of nature."
occur,verb,3,Geology,"happen, take place","To happen or take place, especially without being planned; to exist or be found to be present in a place or situation.","The most powerful earthquakes, known as megathrust earthquakes, occur at convergent plate boundaries where one tectonic plate is forced under another."
demonstrate,verb,3,Physics,"show, illustrate",To show something clearly by giving proof or evidence; to prove or make clear by reasoning or evidence.,"The classic double-slit experiment is often used to demonstrate the wave-particle duality of light, a fundamental concept in quantum mechanics."
campaign,noun,3,Political Science,"drive, movement","A planned series of activities that are intended to achieve a particular aim, especially in politics, business, or social change.",The archaeological campaign unearthed a series of artifacts that fundamentally altered our understanding of the region's early settlement patterns.
conclude,verb,3,Logic and Reasoning,"deduce, infer",To arrive at a judgment or opinion by reasoning; to bring something to an end.,"After analyzing the recurring patterns in the data, the research team was able to conclude that the new compound had a significant effect on cellular regeneration."
independent,adjective,3,Political Science,"autonomous, self-governing",Free from outside control or influence; not depending on another for livelihood or subsistence.,"The treaty formally recognized the nation as a sovereign and independent state, free from the control of any foreign power."
identify,verb,3,Psychology,"recognize, pinpoint",To recognize or establish what or who someone or something is.,Forensic psychologists are often called upon to identify the underlying motivations and psychological state of individuals involved in legal proceedings.
confirm,verb,3,Scientific Research,"verify, corroborate","To establish the truth, accuracy, or validity of something, often by providing new evidence or checking existing information.",Subsequent experiments conducted by an independent laboratory were crucial to confirm the initial findings regarding the new compound's efficacy.
export,verb,3,Economics,"send abroad, sell overseas",To send goods or services to another country for sale or trade.,"Many open-source database management systems provide functionality to export entire databases into a single file, facilitating backups and migration."
consequence,noun,3,Sociology,"result, outcome","A result or effect, typically one that is unwelcome or unpleasant, of an action or condition.","The demographic transition model suggests that a long-term consequence of industrialization and economic development is a significant decline in both birth and death rates, leading to population stabilization."
estimate,verb,3,Economics,"assess, approximate","To form an approximate judgment or calculation of the value, number, quantity, or extent of something.","Based on current market trends and historical data, financial analysts estimate that the company's revenue will grow by 8% in the next fiscal quarter."
assume,verb,3,Physics,"presume, suppose","To accept something as true without proof or certainty, often as a basis for an argument, theory, or course of action.","In deriving the laws of planetary motion, Kepler had to assume that the orbits were elliptical rather than perfect circles, a radical departure from classical astronomical thought."
illustrate,verb,3,Art History,"demonstrate, exemplify","To explain or make something clear by using examples, charts, pictures, or comparisons.","The double-slit experiment is frequently cited to illustrate the paradoxical wave-particle duality of matter, a foundational concept in quantum mechanics."
extension,noun,3,Architecture,"addition, annex",A part that is added to something to enlarge or prolong it; an extra period of time allowed for completing a task or holding an agreement.,"The architect's design for the museum extension was lauded for its innovative use of glass and steel, creating a striking contrast with the original neoclassical facade."
originally,adverb,3,Art History,"initially, at first",In the beginning or before a particular change occurred; at first.,"The building, now a world-renowned art museum, was originally designed as a royal palace, and its opulent halls were intended for state ceremonies rather than public exhibitions."
disease,noun,3,Biology,"illness, ailment","A disorder of structure or function in a human, animal, or plant, especially one that produces specific signs or symptoms or that affects a specific location and is not simply a direct result of physical injury.",The study of epidemiology has contributed much to the understanding of the etiology of a disease and the development of effective public health measures for its prevention and control.
prime,adjective,3,Economics,"principal, chief",Of chief importance; main or principal.,The collapse of the housing market in 2008 is a prime example of how interconnected global financial systems can amplify regional economic downturns.
margin,noun,3,Economics,"leeway, edge",The edge or border of something; the amount by which a thing is won or falls short; an allowance for unforeseen circumstances or a measure of security.,"The study's conclusion must be interpreted with caution, as the statistical margin of error was significantly larger than initially projected."
territory,noun,3,Political Science,"domain, jurisdiction","An area of land under the jurisdiction of a ruler or state; it can also refer to an area defended by an animal or group of animals, or a subject or area of activity that someone has knowledge of or responsibility for.","The treaty officially delineated the territory of the newly independent nation, resolving long-standing border disputes with its neighbors."
inspect,verb,3,Engineering,"examine, scrutinize","To look at something or someone carefully in order to discover information, especially about their quality, condition, or compliance with regulations.","Before construction could begin, civil engineers had to thoroughly inspect the geological stability of the proposed site for the new skyscraper."
distinct,adjective,3,Biology,"different, separate",Recognizably separate or different in nature from something else of a similar type.,"The life cycles of all sexually reproducing organisms follow the same basic pattern, alternating between diploid and haploid stages, though the specifics of the individual life cycles are distinct."
chaos,noun,3,Physics,"disorder, turmoil","A state of complete disorder and confusion, where there is no order or control.","In physics, chaos theory studies the behavior of dynamical systems that are highly sensitive to initial conditions—a phenomenon often referred to as the butterfly effect."
vague,adjective,3,Philosophy,"unclear, imprecise",Not clearly or explicitly stated or expressed; not having a precise meaning.,Early philosophical texts often contain vague terminology that requires careful hermeneutic analysis to decipher the author's original intent.
preference,noun,3,Psychology,"inclination, predilection","A greater liking for one alternative over another or others, often influencing choice and behavior.","In decision theory, a rational agent's preference ordering must be complete and transitive to ensure consistent choices among all available options."
neutral,adjective,3,Political Science,"impartial, unbiased","Not supporting or helping either side in a conflict, disagreement, or competition; having no strongly marked or positive characteristics or features.","In the complex geopolitical landscape of the early 20th century, Switzerland's long-standing policy of armed neutrality was a cornerstone of its foreign policy, allowing it to avoid entanglement in the great power conflicts that engulfed the continent."
enormous,adjective,3,Astronomy,"immense, vast","Extremely large in size, scale, or degree.","The discovery of the enormous cosmic web, a filamentary structure of galaxies stretching across billions of light-years, has revolutionized our understanding of the universe's large-scale structure."
persuade,verb,3,Rhetoric,"convince, induce","To cause someone to do or believe something through reasoning, argument, or entreaty.","In classical rhetoric, the art of logos was central to the speaker's ability to persuade the audience through logical reasoning and evidence-based arguments."
behaviour,noun,3,Psychology,"conduct, demeanor",The way in which an animal or person acts in response to a particular situation or stimulus.,"Ethology, the study of animal behaviour, often examines how innate and learned factors interact to produce complex patterns of action in response to environmental stimuli."
spectrum,noun,3,Physics,"range, continuum","A continuous sequence or range, such as the band of colors produced when light is dispersed by a prism, or more broadly, a wide range of related ideas, qualities, or conditions.","The analysis of the electromagnetic spectrum allows astronomers to determine the chemical composition, temperature, and density of distant celestial objects."
disrupt,verb,3,Sociology,"interrupt, disturb",To interrupt the normal course or unity of something; to cause a disturbance or problem that stops something from continuing as usual.,The introduction of social media has been shown to significantly disrupt traditional patterns of political communication and civic engagement.
inferior,adjective,3,Sociology,"substandard, subordinate","Lower in rank, status, or quality; of less importance, value, or merit.","Historically, many societies constructed elaborate social hierarchies that systematically labeled certain ethnic or social groups as inherently inferior, justifying widespread discrimination and inequality."
severely,adverb,3,Environmental Science,"critically, harshly","In a manner that is very great, intense, or harsh; to a serious or extreme degree.","The prolonged drought has severely affected agricultural output, leading to food shortages in the region."
