word,pos,difficulty,theme,synonyms,definition_en,example_sentence
deficit,noun,5,Economics,"shortfall, shortage",The amount by which a sum of money falls short of the required or expected amount; a shortfall or deficiency.,"When government spending exceeds tax revenues, the resulting budget deficit must be financed by borrowing, which can increase interest rates and affect private investment."
equilibrium,noun,5,Physics,"balance, stability","A state in which opposing forces or influences are balanced, resulting in a stable system where there is no net change.","In a closed system, chemical equilibrium is reached when the rates of the forward and reverse reactions are equal, resulting in no net change in the concentrations of reactants and products."
proliferation,noun,5,Political Science,"escalation, expansion",A rapid and often excessive increase in number or spread of something.,"International treaties aim to prevent the proliferation of nuclear weapons and related technology, promoting disarmament among existing nuclear powers."
corroborate,verb,5,History,"confirm, substantiate","To confirm or give support to a statement, theory, or finding, often with additional evidence or authority.",Newly discovered manuscripts from the monastery's archives corroborate the account of the city's founding that was previously dismissed by scholars as mere folklore.
apathy,noun,5,Psychology,"indifference, lethargy","A lack of interest, enthusiasm, or concern, especially regarding matters of general importance or appeal.","Widespread voter apathy can significantly undermine the legitimacy of democratic processes, as low turnout often reflects a general disillusionment with the political system."
culmination,noun,5,History,"climax, pinnacle","The final point or climax of a process, event, or series of actions; the highest or most decisive point.","The storming of the Bastille on July 14, 1789, is widely regarded as the culmination of the growing social and political unrest that triggered the French Revolution."
futile,adjective,5,History,"fruitless, vain",Incapable of producing any useful result; pointless or having no effect.,"Historical analysis reveals that the peasant uprisings of the late medieval period were largely futile, as they lacked the centralized leadership and military resources to challenge the established feudal order."
engender,verb,5,Sociology,"cause, produce","To cause or give rise to a feeling, situation, or condition.",A government that is perceived as corrupt and unresponsive is likely to engender feelings of cynicism and alienation among its citizens.
resolutely,adverb,5,Political Science,"steadfastly, determinedly","In a determined, purposeful, and unwavering manner.","Despite overwhelming opposition from established political factions, the newly formed party resolutely pursued its agenda for comprehensive institutional reform."
indisputable,adjective,5,History,"incontrovertible, irrefutable",Unable to be challenged or denied; not open to question or dispute because it is so obviously true.,"The discovery of the Rosetta Stone provided indisputable evidence for deciphering ancient Egyptian hieroglyphs, fundamentally changing the field of Egyptology."
disparate,adjective,5,Sociology,"dissimilar, divergent",Fundamentally different or distinct in kind; entirely unalike.,The study aimed to synthesize findings from a wide range of disparate sources to create a more holistic understanding of urban development.
rejuvenate,verb,5,Environmental Science,"revitalize, regenerate","To make someone or something look or feel younger, fresher, or more lively; to restore to a former state or give new energy and vigor to.",The comprehensive conservation plan aims to rejuvenate the degraded wetland ecosystem by reintroducing native flora and improving water flow dynamics.
belligerent,adjective,5,History,"hostile, aggressive",Hostile and aggressive; engaged in or ready for warfare or conflict.,The belligerent posture of the empire towards its smaller neighbors was a primary catalyst for the decades-long conflict that ultimately led to its fragmentation.
oscillation,noun,5,Physics,"fluctuation, vibration",A regular variation in magnitude or position around a central point; a repetitive back-and-forth movement or fluctuation between two states.,The precise measurement of a pendulum's oscillation was fundamental to the development of accurate timekeeping devices and the study of gravitational forces.
eradicate,verb,5,Biology,"eliminate, annihilate","To destroy or get rid of something completely, especially something bad or harmful.","The World Health Organization's global vaccination campaign successfully managed to eradicate smallpox by 1980, a monumental achievement in public health history."
meticulous,adjective,5,Archaeology,"thorough, scrupulous",Showing great attention to detail; being very careful and precise.,"The archaeologist's meticulous excavation of the burial site revealed a complex arrangement of artifacts, providing unprecedented insight into the society's funerary rituals."
impetus,noun,5,History,"stimulus, catalyst",A force that makes something happen or happen more quickly; a driving force or motivation.,"The publication of Rachel Carson's 'Silent Spring' in 1962 provided the impetus for the modern environmental movement, raising widespread public concern over the use of pesticides."
sovereign,adjective,5,Political Science,"autonomous, independent","Possessing supreme or ultimate power; acting or done independently and without outside interference, especially in the context of a state or its governing body.","The Westphalian system is predicated on the principle that each state is sovereign over its territory and domestic affairs, to the exclusion of all external powers."
nomenclature,noun,5,Biology,"terminology, taxonomy","A system of names or terms, or the rules for forming these terms in a particular field of arts or sciences.","The Linnaean system of binomial nomenclature, established in the 18th century, provided a standardized framework for classifying and naming organisms, which revolutionized the field of biology."
empirical,adjective,5,Sociology,"observational, experiential","Based on, concerned with, or verifiable by observation or experience rather than theory or pure logic.","The sociologist's conclusions were not based on mere speculation, but on extensive empirical research involving surveys and interviews with hundreds of participants."
ostentatious,adjective,5,Sociology,"pretentious, flamboyant","Characterized by a vulgar or pretentious display; designed to impress or attract notice, often through excessive wealth or luxury.","The Gilded Age in American history is often characterized by the ostentatious displays of wealth by newly rich industrialists, whose lavish mansions were meant to solidify their social standing."
perpetrate,verb,5,Criminology,"commit, execute","To carry out or commit a harmful, illegal, or immoral action.",The investigation sought to identify the individuals who perpetrated the sophisticated cyber-attack against the nation's critical infrastructure.
prolific,adjective,5,Literature,"productive, fecund","Producing a great number or amount of something, such as works, fruit, or offspring.",The Victorian era was characterized by a number of prolific authors whose serialized novels captivated a rapidly growing literate public.
obviate,verb,5,Engineering,"preclude, prevent",To remove a need or difficulty; to prevent or avoid something undesirable.,"The development of a robust digital infrastructure is intended to obviate the need for physical data storage, thereby reducing operational costs and increasing efficiency."
detrimental,adjective,5,Environmental Science,"harmful, damaging",Tending to cause harm or injury; damaging.,"The runoff of agricultural fertilizers into rivers has a detrimental effect on aquatic ecosystems, leading to algal blooms that deplete oxygen levels."
supersede,verb,5,Law,"replace, supplant",To take the place of something or someone previously in authority or use; to replace it because it is more modern or effective.,"A fundamental principle of statutory interpretation holds that a later, more specific law will supersede an earlier, more general one when the two are in direct conflict."
versatility,noun,5,Materials Science,"adaptability, flexibility",The quality of being able to adapt or be adapted to many different functions or activities.,"The versatility of graphene, a single layer of carbon atoms, is evident in its potential applications across diverse fields, including electronics, energy storage, and biomedical engineering, owing to its exceptional strength and conductivity."
pervade,verb,5,Sociology,"permeate, suffuse","To spread through and be present in every part of something, especially a quality, feeling, or smell.",A sense of deep-seated anxiety began to pervade the society as economic instability and political uncertainty became the new norm.
regression,noun,5,Statistics,"reversion, retrogression","A return to a former or less developed state; in statistics, a measure of the relation between the mean value of one variable and corresponding values of other variables.","In statistical modeling, regression analysis is a set of statistical processes for estimating the relationships between a dependent variable and one or more independent variables."
aberration,noun,5,Astronomy,"anomaly, deviation","A departure from what is normal, usual, or expected, typically one that is unwelcome or causes a problem.","The initial images from the Hubble Space Telescope were blurry due to a spherical aberration in its primary mirror, a flaw that was later corrected by a special optics package."
intrinsic,adjective,5,Philosophy,"inherent, innate",Belonging to the essential nature or constitution of a thing; originating from within.,"The intrinsic value of something is said to be the value that that thing has 'in itself,' or 'for its own sake,' or 'as such,' or 'in its own right.'"
disseminate,verb,5,Communication Studies,"spread, circulate","To spread or give out something, especially news, information, or ideas, to a large number of people.",The primary objective of the research foundation is to disseminate its findings to policymakers and the academic community to foster evidence-based decision-making.
statutory,adjective,5,Law,"legislated, legal","Required, permitted, or enacted by a statute, which is a formal written law passed by a legislative body.",The court's interpretation of the statutory language was crucial in determining the outcome of the case concerning environmental regulations.
postulate,verb,5,Philosophy,"posit, hypothesize","To suggest or assume the existence, fact, or truth of something as a basis for reasoning, discussion, or belief.","In his theory of special relativity, Einstein would postulate that the speed of light in a vacuum is the same for all observers, regardless of the motion of the light source or observer."
expedite,verb,5,Business Administration,"accelerate, hasten",To make an action or process happen sooner or be accomplished more quickly.,The adoption of automated workflow systems was a strategic move to expedite the processing of client requests and reduce operational backlogs.
stagnation,noun,5,Economics,"inactivity, stasis","A state of inactivity, a lack of development, growth, or progress.","In development economics, a poverty trap is a self-reinforcing mechanism which causes poverty to persist, often characterized by prolonged periods of economic stagnation."
feasibility,noun,5,Engineering,"practicability, viability",The quality of being possible and likely to be achieved or successfully completed.,The technical feasibility of the proposed energy-harvesting system was evaluated through a series of rigorous simulations and prototype tests under controlled laboratory conditions.
intractable,adjective,5,Political Science,"unmanageable, recalcitrant","Extremely difficult or impossible to control, manage, or solve.","The long-standing territorial dispute has evolved into an intractable conflict, characterized by deep-seated animosity and a failure of successive diplomatic negotiations."
supplant,verb,5,History,"replace, supersede","To take the place of and serve as a substitute for, especially by force, strategy, or superiority.","The Ptolemaic system, which had dominated astronomical thought for over 1,500 years, was eventually supplanted by the heliocentric model proposed by Copernicus."
conjecture,noun,5,Mathematics,"hypothesis, supposition",An opinion or conclusion formed on the basis of incomplete information; a proposition in mathematics or physics that is unproven.,"For centuries, the Goldbach Conjecture, which posits that every even integer greater than 2 is the sum of two prime numbers, has remained one of the most famous unproven problems in number theory."
coalesce,verb,5,Chemistry,"unite, merge",To come together and form one mass or whole; to combine elements into a single entity.,"In cloud physics, the process starts with water molecules in the air that coalesce into tiny droplets around a condensation nucleus."
amenable,adjective,5,Biology,"receptive, responsive",(of a person) open and responsive to suggestion; easily persuaded or controlled. (of a thing) susceptible to or capable of being acted upon in a particular way.,"The particular strain of bacteria proved to be highly amenable to the new antibiotic, showing a significant reduction in population within 24 hours of exposure."
herbivorous,adjective,5,Biology,"phytophagous, plant-eating",An adjective describing an animal that feeds on plants.,"The evolution of gigantic body sizes in sauropod dinosaurs was likely linked to their herbivorous diet, which required a massive digestive system to process low-nutrient plant matter."
acidification,noun,5,Environmental Science,"acidulation, pH reduction","The process of becoming more acidic, characterized by an increase in the concentration of hydrogen ions and a corresponding decrease in pH.","The primary cause of ocean acidification is the uptake of carbon dioxide from the atmosphere, but it can also be caused by other chemical additions or subtractions from the ocean."
ascendancy,noun,5,History,"supremacy, dominance",The state of having a position of dominant power or influence.,"The 19th century witnessed the ascendancy of the British Empire, whose naval power and industrial capacity allowed it to exert influence across the globe."
consternation,noun,5,Psychology,"dismay, perturbation","A feeling of anxiety or dismay, typically at something unexpected.","The unexpected archeological data, which contradicted decades of established theory, was met with consternation by the historical community, prompting an immediate re-evaluation of previous assumptions."
posterity,noun,5,History,"descendants, future generations","All future generations of people, considered as a collective group.","The meticulous work of the archivists ensures that these invaluable historical documents are preserved for posterity, offering a clear window into the past."
officious,adjective,5,Sociology,"meddlesome, intrusive","Assertive of authority in an annoyingly domineering way, especially with regard to petty matters; intrusively enthusiastic in offering help or advice; meddlesome.","In Weber's model of bureaucracy, the potential for an 'iron cage' of rationality emerges when functionaries become overly officious, prioritizing procedural adherence above the substantive goals of the organization."
congenital,adjective,5,Biology,"inborn, innate",Relating to a disease or physical abnormality present from birth.,"The research identified several genetic mutations responsible for the congenital malformation of the heart, a condition that develops before birth."
secession,noun,5,Political Science,"withdrawal, separation",The formal act of a state or region withdrawing from a federation or larger political body to become independent.,"The legality of unilateral secession is a contentious issue in international law, often pitting the principle of self-determination against the principle of territorial integrity."
anomalous,adjective,5,Astronomy,"atypical, aberrant","Deviating from what is standard, normal, or expected.",The Pioneer anomaly was the observed anomalous blueshifted Doppler frequency shifts of the Pioneer 10 and 11 spacecraft when they were more than 20 astronomical units from the Sun.
vertebrate,noun,5,Biology,"craniate, backboned animal","An animal of a large group distinguished by the possession of a backbone or spinal column, including mammals, birds, reptiles, amphibians, and fishes.","The evolution of jaws was a pivotal event in early vertebrate history, fundamentally altering their ecological roles and enabling them to become dominant predators."
dormancy,noun,5,Biology,"inactivity, quiescence","A state of temporary inactivity or suspended animation, characterized by a significant reduction in metabolic rate, growth, and development to conserve energy.","The prolonged dormancy of certain bacterial spores allows them to survive extreme environmental conditions, such as desiccation and high temperatures, for extended periods."
inert,adjective,5,Chemistry,"inactive, unreactive",Lacking the ability or strength to move; chemically inactive or non-reactive.,The noble gases are the most stable and inert elements due to having the maximum number of valence electrons their outer shell can hold.
salinity,noun,5,Oceanography,"saltiness, salt content","The concentration of dissolved salts in water, typically expressed in parts per thousand (ppt).","Salinity is an important factor in determining many aspects of the chemistry of natural waters and of biological processes within it, and is a thermodynamic state variable that, along with temperature and pressure, governs physical characteristics like the density and heat capacity of the water."
amplification,noun,5,Physics,"augmentation, intensification","The process of increasing the volume, strength, or significance of something, such as a sound, an electrical signal, or an idea.","In signal processing, the amplification of a weak radio signal is essential for clear reception and data extraction."
subversive,adjective,5,Political Science,"insurgent, seditious",Tending or intended to undermine the power and authority of an established system or institution.,The distribution of pamphlets containing subversive ideas was a common tactic used by revolutionary groups to undermine the monarchy's authority.
inasmuchas,conjunction,5,Law,"since, because","A formal conjunction used to introduce a reason, justification, or explanation for a preceding statement; equivalent to 'because' or 'since'.",The contract was declared void inasmuch as one of the signatories was proven to be under duress at the time of its execution.
preconceive,verb,5,Psychology,"prejudge, presuppose","To form an opinion or idea about something beforehand, often without sufficient evidence or reason.","In rigorous scientific inquiry, researchers are trained to avoid preconceiving the results, instead allowing the empirical evidence to shape their conclusions without bias."
enmity,noun,5,History,"hostility, antagonism","A state or feeling of active opposition or hostility; deep-seated, mutual hatred or ill will.","The long-standing enmity between the two city-states, fueled by economic competition and territorial disputes, eventually erupted into a full-scale war that reshaped the geopolitical landscape of the ancient world."
reverberate,verb,5,Sociology,"resonate, echo",To be repeated several times as an echo; to have continuing and serious effects or repercussions that spread widely.,"The social and economic consequences of the new legislation continued to reverberate throughout the community, affecting everything from local employment to public services."
suffrage,noun,5,History,"franchise, the vote",The right to vote in political elections.,"The passage of the Nineteenth Amendment to the United States Constitution, which granted women national suffrage, was the culmination of a decades-long movement for women's rights."
irreducible,adjective,5,Philosophy,"fundamental, indivisible","Not able to be reduced, simplified, or broken down into smaller or simpler components.","Some philosophers hold that consciousness is an irreducible, non-physical feature of the world, distinct from and not explainable by its physical features."
inundate,verb,5,Sociology,"overwhelm, deluge",To overwhelm someone with a large quantity of things or people that must be dealt with; to flood an area with water.,"The digital age has caused modern citizens to be inundated with a constant stream of information, making it difficult to discern credible sources from misinformation."
agronomist,noun,5,Agricultural Science,"agricultural scientist, crop scientist",An expert in the science of soil management and crop production.,"The agronomist developed a new strain of drought-resistant wheat, a breakthrough that could significantly enhance food security in arid regions."
appendage,noun,5,Biology,"limb, extremity","A part that is joined to something larger, especially a limb or other subsidiary part of an animal's body.","The evolution of the arthropod appendage has been a subject of intense debate, with fossil evidence suggesting a common biramous origin for many groups."
telepathic,adjective,5,Psychology,"mind-reading, thought-transference","Relating to or having the supposed ability to communicate with another person's mind without using speech, writing, or any other normal method of communication.","Despite decades of research into parapsychology, no conclusive evidence has ever been presented to substantiate the existence of a genuinely telepathic connection between individuals."
prehensile,adjective,5,Biology,"grasping, gripping",(chiefly of an animal's limb or tail) capable of grasping or seizing.,"Many New World monkeys possess prehensile tails, which they utilize almost like a fifth limb for enhanced arboreal locomotion and stability."
cretaceous,adjective,5,Geology,"chalky, calcareous","Relating to or denoting the last period of the Mesozoic era, between the Jurassic and Tertiary periods, or the system of rocks deposited during it.","The extensive chalk deposits of Western Europe, for which the period is named, are characteristic of the Upper Cretaceous epoch."
desalination,noun,5,Environmental Science,"desalinization, desalting","The process of removing salt and other minerals from a substance, especially from seawater or brackish water, to produce fresh water.","The primary challenge of large-scale desalination is its high energy consumption, which has significant economic and environmental implications, particularly in regions reliant on fossil fuels."
ferrous,adjective,5,Chemistry,"iron-bearing, ferriferous","Relating to, containing, or derived from iron, typically in the bivalent state (Fe2+).","The transition from an anoxic, ferrous iron-rich ocean to an oxic, iron-poor ocean was a pivotal event in Earth's geochemical history."
demobilize,verb,5,History,"disband, decommission","To take troops out of active service, typically at the end of a war or conflict.","Following the armistice, the victorious nations faced the monumental logistical challenge to demobilize millions of soldiers and reintegrate them into a peacetime economy."
calorific,adjective,5,Biology,"heat-producing, energy-yielding",Relating to the amount of energy contained in food or fuel; heat-producing.,"The calorific value of a food item is determined by the amount of energy it releases upon complete combustion, a value crucial for metabolic studies."
impregnate,verb,5,Biology,"fertilize, inseminate","To make pregnant or fertilize an egg; to cause a substance to be filled, saturated, or soaked with another substance.","In many species of flowering plants, specific pollinators are required to transfer pollen effectively and impregnate the ovules, ensuring successful seed production."
conjointly,adverb,5,Law,"jointly, collectively",In conjunction with another or others; unitedly or together.,The treaty stipulates that both nations are conjointly responsible for the protection of the shared waterway and its ecological systems.
preposterous,adjective,5,History,"absurd, ludicrous",Completely contrary to reason or common sense; utterly absurd or ridiculous.,The notion that the ancient pyramids were built by extraterrestrial beings is a preposterous theory that lacks any credible archaeological evidence.
enshroud,verb,5,Meteorology,"envelop, conceal","To envelop completely and hide from view, often creating a sense of mystery or obscurity.","The dense clouds of sulfuric acid that enshroud Venus obscure its surface from visible light imaging, making direct observation challenging for astronomers."
wantonly,adverb,5,History,"maliciously, recklessly","In a deliberate, cruel, or immoral way, without motive or provocation, and with a reckless disregard for justice or consequences.","During the sack of the city, cultural treasures and libraries were wantonly destroyed by the invading forces, an act condemned by later historians as barbaric."
quintessence,noun,5,Philosophy,"epitome, embodiment",The most perfect or typical example of a quality or class; the pure and concentrated essence of a substance.,"In ancient and medieval philosophy, the quintessence was postulated as the fifth element, a divine substance believed to compose the celestial bodies and distinct from the four terrestrial elements."
