word,pos,difficulty,theme,synonyms,definition_en,example_sentence
neutrality,noun,4,Political Science,"impartiality, nonpartisanship","The state of not supporting or helping either side in a conflict, disagreement, or war; impartiality.","In international law, the concept of neutrality obligates a state to abstain from participating in a war between other states and to maintain an impartial attitude towards the belligerents."
deplore,verb,4,Sociology,"lament, condemn",To feel or express strong disapproval of something; to regret deeply.,"Many sociologists deplore the systemic inequalities that persist in modern societies, arguing that they undermine social cohesion and individual potential."
degeneration,noun,4,Biology,"deterioration, decline","The process of declining to a lower or worse state, often involving the loss of function or structure in tissues, cells, or organs.","The study focuses on the molecular mechanisms underlying the degeneration of retinal photoreceptor cells, a key factor in age-related vision loss."
covenant,noun,4,Law,"pact, agreement","A formal and binding agreement, contract, or pact, especially one made in a religious or legal context that involves a solemn promise.","The Mayflower Compact is often cited as a foundational covenant in American political thought, establishing a civil body politic based on mutual consent and just laws."
malign,adjective,4,Political Science,"harmful, malevolent","Evil in nature, influence, or effect; malevolent.","The investigation concluded that the state-sponsored disinformation campaign had a malign influence on the election's outcome, eroding public trust in democratic institutions."
ensue,verb,4,History,"follow, result",To happen or occur afterward or as a result of a preceding event or action.,"Following the collapse of the Roman Empire, a period of political fragmentation and economic decline ensued in Western Europe."
interrogate,verb,4,Law,"question, examine","To ask questions of someone closely, aggressively, or formally, often in a systematic way to elicit specific information, as in a legal, military, or research context.","In social science research, ethnographers often interrogate their own assumptions and biases to ensure the objectivity of their findings."
constrain,verb,4,Economics,"restrict, limit","To compel or force someone toward a particular course of action; to severely restrict the scope, extent, or activity of something.","Economic models often assume that rational agents make choices to maximize their utility, but are constrained by a limited budget."
ceaseless,adjective,4,Geology,"incessant, unremitting",Continuing without pause or interruption; constant and unending.,"The geological record reveals the ceaseless process of erosion, where wind and water have sculpted the planet's surface over millions of years."
rebuke,verb,4,Political Science,"reprimand, admonish","To express sharp, stern disapproval or criticism of (someone) because of their behavior or actions.","In a rare display of diplomatic unity, the international assembly voted to formally rebuke the country for its failure to adhere to the environmental accord."
havoc,noun,4,History,"devastation, destruction",Widespread destruction; great confusion or disorder.,"The Thirty Years' War wreaked havoc across Central Europe, leading to immense population decline and the fragmentation of the Holy Roman Empire."
inaudible,adjective,4,Acoustics,"unheard, imperceptible",Unable to be heard; not loud enough to be audible.,"Bats navigate using echolocation, emitting ultrasonic calls that are inaudible to the human ear but provide a detailed acoustic map of their surroundings."
banish,verb,4,History,"exile, expel",To send someone away from a country or place as an official punishment; to get rid of something unwanted.,"After his final defeat at the Battle of Waterloo, Napoleon Bonaparte was banished to the remote island of Saint Helena, effectively ending his political and military career."
intrigue,verb,4,Psychology,"fascinate, captivate","To arouse the curiosity or interest of; to fascinate someone, often because something is unusual, mysterious, or complex.","The psychological mechanisms underlying the placebo effect continue to intrigue researchers, prompting extensive investigation into the power of belief on physiological outcomes."
daunt,verb,4,Psychology,"intimidate, discourage",To make someone feel intimidated or apprehensive about a task or situation.,"The complexity of mapping the human neural network is a task that would daunt even the most seasoned neuroscientists, yet it remains a central goal of modern cognitive science."
plaintiff,noun,4,Law,"complainant, claimant",A person who brings a case against another in a court of law.,"In the landmark case, the plaintiff alleged that the corporation's negligence directly resulted in significant environmental damage, presenting extensive hydrogeological data as evidence."
abound,verb,4,Biology,"flourish, thrive",To exist in large numbers or amounts.,"The tidal pools along the rocky coastline abound with a diverse array of marine invertebrates, from sea anemones to starfish."
refrain,verb,4,Sociology,"abstain, desist","To stop oneself from doing something, especially an action that one desires to take.","In ethnographic studies, researchers are ethically obligated to refrain from interfering with the cultural practices of the community they are observing, even if those practices conflict with their own values."
ruthless,adjective,4,History,"merciless, remorseless",Having or showing no pity or compassion for others.,The expansion of the Roman Empire was often achieved through ruthless military campaigns that subjugated local populations without regard for their cultural traditions or autonomy.
antiquity,noun,4,History,"ancient times, the distant past","The ancient past, especially the period of classical and other human civilizations before the Middle Ages.","The study of classical antiquity is crucial for understanding the foundations of Western civilization, encompassing the interlocking civilizations of ancient Greece and ancient Rome."
amass,verb,4,History,"accumulate, gather","To gather or collect a large quantity of something, especially information, wealth, or power, over a period of time.","Over decades of meticulous excavation, archaeologists were able to amass a substantial body of evidence that challenged previous theories about the settlement's origins."
overrule,verb,4,Law,"override, veto","To use one's superior authority to reject or change a decision, ruling, or proposal made by someone with less authority.","In a landmark case, the Supreme Court chose to overrule the precedent established decades earlier, signaling a significant shift in judicial interpretation."
remnant,noun,4,Archaeology,"remainder, vestige",A small remaining quantity of something; a surviving trace or part of something that has disappeared or been destroyed.,"Archaeologists carefully excavated the site, hoping to uncover any remnant of the ancient settlement's structure before the new construction project began."
chronicle,noun,4,History,"record, account",A factual written account of important or historical events in the order of their occurrence.,"The Anglo-Saxon Chronicle, a collection of annals in Old English, provides a detailed historical record of the Anglo-Saxons from the 9th to the 12th century."
genesis,noun,4,History,"origin, inception",The origin or mode of formation of something.,"Theories of the genesis of the state can be classified into two basic types: those that explain the state in terms of some rational contract, and those that explain it in terms of natural growth."
lineage,noun,4,Biology,"ancestry, descent","The series of ancestors from which a person, family, or group of organisms is descended.","In evolutionary biology, a lineage is a sequence of species that form a line of descent, with each new species being the direct result of speciation from an immediate ancestral species."
dispel,verb,4,Psychology,"banish, dissipate","To make a doubt, feeling, or belief disappear, often by proving it to be false.",The researcher's comprehensive study was instrumental in helping to dispel the long-held notion that certain cognitive abilities inevitably decline with age.
addendum,noun,4,Publishing,"supplement, appendix","An item of additional material, typically omissions or corrections, added at the end of a book, report, or other document.","The research team later published an addendum to their initial study, providing supplementary data that addressed the peer reviewers' primary concerns."
plead,verb,4,Law,"beg, implore",To make an emotional or earnest appeal to someone; to state formally in court whether one is guilty or not guilty of a crime.,"In historical legal systems, individuals without representation often had to plead their own cases directly before the monarch, a practice that highlighted the vast power imbalances of the era."
quarantine,noun,4,Public Health,"isolation, seclusion","A state, period, or place of isolation in which people, animals, or plants that have arrived from elsewhere or been exposed to infectious or contagious disease are placed to prevent its spread.","The effectiveness of quarantine as a public health measure is often debated, particularly concerning its economic impact versus its role in containing the spread of novel pathogens."
transplant,verb,4,Biology,"relocate, replant","To move an organ, tissue, or living thing from one body or place to another.","To minimize shock, it is crucial to transplant seedlings during cooler parts of the day and ensure the root ball remains intact."
dissuade,verb,4,Psychology,"deter, discourage",To persuade someone not to take a particular course of action by advising or arguing against it.,Early intervention programs in schools are designed to dissuade at-risk youth from joining gangs by offering alternative social structures and opportunities.
intimacy,noun,4,Psychology,"closeness, familiarity","A state of close, personal relationship or connection, often characterized by deep emotional attachment, understanding, and familiarity.","Erik Erikson's theory of psychosocial development posits that young adults must resolve the conflict between intimacy and isolation to form meaningful, long-lasting relationships."
invalid,adjective,4,Logic,"void, unsound",Not based on sound principles or evidence; not legally or officially acceptable.,"In formal logic, an argument is considered invalid if the conclusion does not necessarily follow from the premises, even if those premises are factually correct."
tamper,verb,4,Law,"interfere, meddle",To interfere with something in order to cause damage or make unauthorized alterations.,"Forensic protocols are designed to create a clear chain of custody, ensuring that evidence is not lost, contaminated, or tampered with before it can be analyzed in a laboratory."
inborn,adjective,4,Psychology,"innate, inherent","A quality or ability that is natural to a person or animal, existing from birth.",The long-standing debate in psychology revolves around whether complex human behaviors are learned through experience or are manifestations of inborn tendencies.
dwell,verb,4,Psychology,"brood, linger","To think, speak, or write at length about a particular subject, especially one that is a source of unhappiness, anxiety, or dissatisfaction.","Cognitive-behavioral therapy often aims to prevent patients from dwelling on past failures, instead encouraging them to focus on present coping mechanisms."
exquisite,adjective,4,Art History,"superb, magnificent","Extremely beautiful, delicate, or refined; of special beauty, charm, or rare and appealing excellence.","The archaeological team unearthed an exquisite mosaic floor from the Roman era, its intricate patterns and vibrant colors remarkably preserved after centuries underground."
elude,verb,4,Neuroscience,"evade, escape","To escape from or avoid a danger or enemy, typically in a skillful way; to fail to be grasped, understood, or remembered by someone.","Despite decades of intensive research, the precise neural mechanisms underlying long-term memory consolidation continue to elude neuroscientists."
diffuse,verb,4,Sociology,"spread, disperse",To spread or cause to spread over a wide area or among a large number of people.,"The theory of the diffusion of innovations seeks to explain how, why, and at what rate new ideas and technology diffuse through various social systems."
propel,verb,4,Physics,"drive, impel","To drive, push, or cause to move in a particular direction, typically forward.","In ion thrusters, an electric field is used to accelerate and expel ions, which in turn propel the spacecraft forward with remarkable efficiency over long durations."
beset,verb,4,Sociology,"plague, beleaguer",To trouble or threaten persistently; to surround or hem in.,"Throughout history, developing nations have often been beset by a cycle of poverty and political instability, hindering their progress on the global stage."
stagnant,adjective,4,Economics,"sluggish, inactive","Characterized by a lack of activity, growth, or development; not advancing or progressing.","During the 1970s, many Western economies were described as stagnant, experiencing a debilitating combination of high inflation and low economic growth known as stagflation."
fringe,noun/verb/adjective,4,Sociology,"periphery, margin","As a noun, the outer, marginal, or less important part of an area, group, or activity. As an adjective, not part of the mainstream; unconventional, peripheral, or extreme.","Sociological studies often examine how fringe political movements, initially operating on the periphery of mainstream discourse, can sometimes gain significant traction and influence public opinion."
disdain,noun/verb,4,Sociology,"contempt, scorn",The feeling that someone or something is unworthy of one's consideration or respect; contempt.,"The patrician class, secure in its inherited status, often showed a profound disdain for the burgeoning merchant class, viewing their commercial pursuits as vulgar and lacking in honor."
contour,noun/verb,4,Geography,"outline, silhouette","As a noun, the outline representing the shape or form of something; as a verb, to shape or mold to fit a particular form.","In cartography, a contour line is an essential tool for representing the three-dimensional shape of the terrain on a two-dimensional map, connecting points of equal elevation."
incompetence,noun,4,Management,"inadequacy, incapability","The lack of skill, knowledge, or ability to do something successfully or to a required standard.",The commission's report cited gross managerial incompetence as the primary reason for the catastrophic failure of the public works project.
incessant,adjective,4,Meteorology,"ceaseless, constant","Continuing without pause or interruption, often in an annoying or tiring way.","The incessant downpour over several days led to widespread flooding, forcing the evacuation of coastal communities and disrupting critical infrastructure."
celestial,adjective,4,Astronomy,"heavenly, astronomical","Positioned in or relating to the sky, outer space, or the heavens.","The study of celestial mechanics involves analyzing the motions of objects in outer space, such as planets, stars, and galaxies, under the influence of gravitational forces."
insatiable,adjective,4,Psychology,"unquenchable, voracious","(of an appetite, desire, or demand) impossible to satisfy; constantly wanting more.","The researcher's insatiable curiosity drove her to spend decades in the remote jungle, meticulously documenting the behavior of previously unknown species."
immunity,noun,4,Biology,"resistance, insusceptibility","The ability of an organism to resist a particular infection or toxin by the action of specific antibodies or sensitized white blood cells; also, official protection from legal action or liability.","The principle of herd immunity is fundamental to public health, describing the indirect protection from infectious disease that occurs when a sufficient percentage of a population has become immune."
formidable,adjective,4,History,"intimidating, daunting","Inspiring fear or respect through being impressively large, powerful, intense, or capable.",The logistical challenge of crossing the Alps with a full army and war elephants presented a formidable obstacle for Hannibal's campaign against Rome.
countermeasure,noun,4,Cybersecurity,"safeguard, preventive measure","An action taken to counteract a danger, threat, or undesirable consequence.",The new encryption standard was implemented as a countermeasure against increasingly sophisticated man-in-the-middle attacks that threatened the integrity of the network.
sabotage,verb,4,Political Science,"undermine, disrupt","To deliberately destroy, damage, or obstruct something, especially for political, military, or industrial advantage.","During the Cold War, intelligence agencies from both superpowers engaged in covert operations designed to sabotage the military and economic infrastructure of their adversaries."
encode,verb,4,Computer Science,"cipher, encrypt","To convert information or a message into a particular code, especially for data processing, storage, or to prevent unauthorized access.","The Huffman algorithm is a classic example of a lossless data compression technique used to encode symbols based on their frequency of occurrence, assigning shorter codes to more frequent symbols."
jargon,noun,4,Linguistics,"terminology, lingo",Special words or expressions that are used by a particular profession or group and are difficult for others to understand.,"The research paper was initially impenetrable to non-specialists due to its dense use of quantum mechanics jargon, which obscured the groundbreaking nature of its findings."
administrate,verb,4,Political Science,"manage, govern","To manage and be responsible for the running of a business, organization, program, or state; to dispense or apply (a remedy, justice, etc.).","The international tribunal was established to administrate justice for war crimes, ensuring that legal processes were followed impartially."
apparatus,noun,4,Physics,"equipment, machinery","A set of equipment, machinery, or tools used for a particular purpose, especially in a scientific or technical context; it can also refer to the complex structure of a particular organization or system.","The Michelson–Morley experiment was performed between April and July 1887 with an apparatus called the Michelson interferometer, which was designed to detect the relative motion of matter through the stationary luminiferous aether."
counterfeit,adjective,4,Economics,"fake, forged",Made in exact imitation of something valuable or important with the intention to deceive or defraud.,The proliferation of counterfeit goods in the global market not only undermines intellectual property rights but also poses significant risks to consumer safety and national economies.
revert,verb,4,Biology,"return, regress","To return to a former state, practice, condition, or belief.","In genetic studies, a back mutation is a specific type of point mutation that causes a mutated gene to revert to its original, non-mutated sequence, thereby restoring the wild-type phenotype."
complacent,adjective,4,Sociology,"smug, self-satisfied","Showing smug or uncritical satisfaction with oneself or one's achievements, often without awareness of potential dangers or defects.","After decades of economic dominance, the nation's leadership grew complacent, underestimating the rapid technological advancements of its global competitors."
amnesty,noun,4,Political Science,"pardon, reprieve",An official pardon for people who have been convicted of political offenses; a period during which a law is suspended to allow offenders to admit their crime without fear of prosecution.,The Immigration Reform and Control Act of 1986 granted a general amnesty to certain undocumented immigrants who had entered the United States prior to 1982.
circulatory,adjective,4,Biology,"vascular, circulating","Pertaining to the system that moves blood, lymph, and other fluids throughout the body of an organism.","The evolution of a closed circulatory system was a pivotal development, enabling larger, more active organisms to efficiently transport oxygen and nutrients to tissues far from the sites of absorption and gas exchange."
revoke,verb,4,Law,"rescind, cancel","To officially cancel a decree, decision, or promise, making it no longer valid.",The regulatory agency warned that it would revoke the operating license of any financial institution found to be non-compliant with the new anti-money laundering statutes.
fabricate,verb,4,History,"concoct, falsify","To invent or produce something false, such as a story or a piece of information, in order to deceive someone.","The investigation revealed that the researcher had fabricated data to support his groundbreaking, yet ultimately fraudulent, claims about the newly discovered archaeological site."
forgery,noun,4,Art History,"counterfeit, falsification","The action of producing a fraudulent copy or imitation of a document, signature, banknote, or work of art.","The discovery of anachronistic pigments in the paint layers was conclusive evidence that the supposed Renaissance masterpiece was, in fact, a modern forgery."
meteorology,noun,4,Earth Science,"atmospheric science, weather science","The branch of science concerned with the processes and phenomena of the atmosphere, especially as a means of forecasting the weather.","Advancements in computational power have revolutionized the field of meteorology, allowing for more accurate and long-range weather forecasting through complex atmospheric models."
surgical,adjective,4,Medicine,"precise, meticulous","Relating to or used in surgery; characterized by extreme precision, accuracy, and care, as if performed by a surgeon.","The laser's ability to etch microscopic circuits onto the silicon wafer requires surgical precision, with tolerances measured in nanometers."
docile,adjective,4,Biology,"submissive, compliant",Ready to accept control or instruction; submissive and easily managed.,"Early theories of domestication suggested that humans actively selected for more docile individuals, leading to a suite of correlated traits over generations."
colonize,verb,4,History,"settle, populate",To establish political control over another country or area by sending people to live there; or for a plant or animal to establish itself and grow in a new place.,"From the 16th to the 20th centuries, European powers sought to colonize vast territories in the Americas, Africa, and Asia, fundamentally altering the political and social landscapes of these regions."
paralyse,verb,4,Biology,"immobilize, incapacitate","To cause a person, animal, or part of the body to lose the ability to move or feel; metaphorically, to make something unable to act or function.","The toxin works by binding to nerve endings, which can paralyse the muscles required for breathing, leading to respiratory failure in the victim."
adherent,noun,4,Sociology,"follower, supporter","Someone who supports a particular party, person, or set of ideas.","Despite the internal schisms, adherents of the classical liberal tradition continued to advocate for minimal government intervention in the economy."
communal,adjective,4,Sociology,"shared, collective",Relating to or shared by all the members of a community; for common use.,"Archaeological evidence from early settlements indicates a strong reliance on communal granaries, which were essential for storing surplus food and ensuring the group's survival through lean seasons."
constipation,noun,4,Medicine,"irregularity, costiveness","A condition in which there is difficulty in emptying the bowels, usually associated with hardened feces.","Chronic constipation is often multifactorial, resulting from a combination of dietary habits, inadequate fluid intake, and reduced physical activity."
intestine,noun,4,Biology,"bowel, gut","The long, continuous tube running from the stomach to the anus; its main function is to complete the digestion of food and absorb nutrients.","The primary function of the small intestine is the absorption of nutrients and minerals from food, a process facilitated by its vast surface area."
strew,verb,4,Archaeology,"scatter, disperse",To scatter or spread things untidily over a surface or area.,"During the excavation of the ancient settlement, archaeologists discovered that the remains of ceremonial vessels were strewn across the floor of the main chamber, suggesting a sudden and violent collapse of the structure."
pert,adjective,4,Psychology,"impudent, saucy","Characterized by a lively, bold, and somewhat cheeky or impertinent manner, often in an attractive or amusing way.","In her analysis, the critic noted how the protagonist's initially pert and dismissive attitude toward societal norms gradually evolved into a more nuanced understanding of her own agency."
hurtle,verb,4,Astronomy,"career, speed","To move at a great speed, typically in a wildly uncontrolled manner.","Astronomical models predict that the rogue comet will hurtle through the inner solar system, its trajectory altered only by the gravitational pull of larger planets."
crevice,noun,4,Geology,"fissure, cleft","A narrow opening or fissure, especially in a rock or wall.","In geology, a crevice is a fracture or crack in rock, which can be a result of tectonic forces or weathering processes over extended periods."
