word,pos,difficulty,theme,synonyms,definition_en,example_sentence
execute,verb,4,Computer Science,"implement, perform","To carry out or put into effect a plan, order, or course of action.","The central processing unit (CPU) is designed to fetch, decode, and execute instructions stored in the computer's memory."
specialization,noun,4,Economics,"concentration, expertise","The process of concentrating on and becoming an expert in a particular subject or skill, often leading to greater efficiency and knowledge in a narrow field.","The advent of agriculture allowed for greater specialization of labor, as not everyone needed to be involved in food production, leading to the rise of artisans, soldiers, and priests."
conversion,noun,4,Chemistry,"transformation, alteration","The process of changing or causing something to change from one form, substance, character, or function to another.","In catalysis, the reaction rate and the conversion of reactants to products are highly dependent on the surface area and active sites of the catalyst."
impair,verb,4,Medicine/Biology,"weaken, damage","To weaken, damage, or make something less effective or complete.","Chronic sleep deprivation is known to significantly impair cognitive functions, including memory consolidation and executive decision-making."
considerably,adverb,4,Environmental Science,"significantly, substantially",To a large or noticeable degree; by a great amount.,"The concentration of greenhouse gases in the atmosphere has increased considerably since the Industrial Revolution, leading to measurable changes in global climate patterns."
enact,verb,4,Political Science,"legislate, implement","To make a bill or proposal into a law; to put into practice or act out a role, idea, or suggestion.","The legislature moved to enact the new tax code, hoping it would stimulate economic growth by providing relief to small businesses."
manifest,verb,4,Psychology,"display, reveal","To show a quality, feeling, or illness, or to make it appear or become noticeable.","Psychological distress can manifest itself in a variety of physical symptoms, including headaches and fatigue, a phenomenon known as somatization."
genocide,noun,4,History,"annihilation, extermination",The deliberate and systematic killing of a large number of people from a particular nation or ethnic group with the aim of destroying that nation or group.,"The 1948 Genocide Convention established a legal framework for prosecuting individuals and states responsible for acts intended to destroy, in whole or in part, a national, ethnical, racial, or religious group."
exemplify,verb,4,Sociology,"illustrate, typify",To be a typical or characteristic example of something; to serve as an illustration of a point.,"The works of Émile Durkheim, Karl Marx, and Max Weber exemplify the sociological perspective, each offering a distinct framework for analyzing the relationship between individuals and society."
innate,adjective,4,Psychology,"inborn, inherent","A quality or ability that you are born with, not one you have learned or developed through experience.","The debate over whether complex behaviors are innate or learned is a central theme in developmental psychology, often referred to as the 'nature versus nurture' controversy."
aptitude,noun,4,Psychology,"talent, knack",A natural talent or inherent capacity for learning or proficiency in a particular area.,The study investigated the correlation between scholastic aptitude tests and subsequent academic performance in university-level engineering programs.
subsidize,verb,4,Economics,"fund, finance","To support an organization or activity financially; to pay part of the cost of something, usually to reduce prices for the buyer.","To ensure national food security and support rural communities, the government implemented a policy to heavily subsidize the agricultural sector, thereby artificially lowering the market price of staple crops."
uphold,verb,4,Law,"maintain, support","To confirm, support, or maintain a principle, decision, or law, especially when it is being challenged.",The appellate court's decision to uphold the conviction was based on overwhelming evidence presented during the initial trial.
premium,noun,4,Economics,"surcharge, fee","An amount paid for a contract of insurance; a sum added to an ordinary price or value, often to reflect superior quality or higher demand.","In financial markets, investors often demand a risk premium for holding assets with uncertain future returns, compensating them for the additional volatility."
entity,noun,4,Philosophy,"being, existence","Something that exists as a distinct, separate, or independent unit, whether it is a person, object, organization, or concept.","In metaphysics, philosophers debate whether an abstract entity, such as a number or a proposition, exists independently of human consciousness."
foremost,adjective,4,History,"leading, principal","Most prominent in rank, importance, or position; chief.","As the foremost proponent of the heliocentric model, Copernicus's work fundamentally challenged the established astronomical and religious doctrines of his era."
unbiased,adjective,4,Sociology,"impartial, objective",Not influenced by personal feelings or opinions in considering and representing facts; impartial.,"To ensure the validity of the study, researchers must collect data from an unbiased sample of the population, representing all subgroups proportionally."
endorse,verb,4,Political Science,"support, advocate","To declare one's public approval or support of someone or something, often in a formal or official capacity.",The non-partisan commission was established to evaluate the proposed legislation but was strictly forbidden from endorsing any particular political party's interpretation of it.
abundance,noun,4,Biology,"profusion, plenitude",A very large quantity of something; a plentiful amount.,"In ecology, abundance is a component of biodiversity and refers to how common or rare a species is relative to other species in a defined location or community."
legitimate,adjective,4,Political Science,"valid, lawful",Conforming to the law or to rules; able to be defended with logic or justification; valid and reasonable.,"In political science, a government's legitimacy is derived from the consent of the governed, which is considered the only legitimate basis for political power."
embody,verb,4,Sociology,"personify, epitomize","To be a tangible or visible form of an idea, quality, or feeling; to represent or be an expression of something in a clear and obvious way.","The new constitution was designed to embody the principles of liberty and justice for all citizens, marking a significant departure from the previous autocratic regime."
notably,adverb,4,Art History,"particularly, especially","Used to introduce a particularly important, interesting, or significant example or detail.","The Renaissance saw a surge in artistic innovation, with several artists contributing to this cultural rebirth, notably Leonardo da Vinci, whose works blended scientific observation with unparalleled artistic skill."
tentative,adjective,4,Scientific Research,"provisional, uncertain",Not certain or fixed; provisional; done without confidence or with hesitation.,"The research team presented their tentative conclusions at the conference, emphasizing that further data was needed for confirmation."
reconcile,verb,4,History,"harmonize, resolve","To find a way to make two or more ideas, facts, or situations that seem to be in conflict with each other compatible or consistent.","Historians often struggle to reconcile contradictory eyewitness accounts of the same event, requiring careful analysis of bias and perspective."
enhancement,noun,4,Technology,"improvement, augmentation","An increase or improvement in quality, value, or extent.",The application of digital filters for the enhancement of contrast in medical imaging allows for more accurate diagnoses by physicians.
ample,adjective,4,Archaeology,"plentiful, abundant",Enough or more than enough; plentiful.,Archaeological excavations at the site have provided ample evidence of a complex society with advanced agricultural practices.
surveillance,noun,4,Sociology,"monitoring, observation","The close observation of a person or group, especially one under suspicion, or the monitoring of behavior, activities, or data for the purpose of influencing, managing, or protecting.","Michel Foucault's concept of the Panopticon illustrates how modern disciplinary societies exercise power through pervasive, yet often invisible, systems of surveillance, leading individuals to self-regulate their behavior."
counterpart,noun,4,Political Science,"equivalent, parallel",A person or thing that holds a position or performs a function that corresponds to that of another person or thing in a different place or situation.,"The legislative powers of the U.S. Senate, particularly in ratifying treaties, have no direct counterpart in the British House of Lords, highlighting a fundamental divergence in the two bicameral systems."
sparse,adjective,4,Ecology,"scant, meager",Small in number or amount and spread out over a large area; thinly dispersed or scattered.,"In machine learning, dealing with sparse data, where most of the entries in a dataset are zero, requires specialized algorithms to avoid computational inefficiency."
reliance,noun,4,Sociology,"dependence, trust",The state of depending on or trusting in someone or something for help or support.,The country's over-reliance on a single export commodity made its economy exceptionally vulnerable to global price fluctuations.
endeavour,noun,4,History,"undertaking, attempt","A serious, determined, and often prolonged attempt to achieve a difficult goal.",The construction of the Panama Canal was a monumental engineering endeavour that fundamentally altered global trade routes and maritime strategy in the early 20th century.
disintegrate,verb,4,Physics,"crumble, break apart","To break up into small parts or pieces, often as a result of impact, decay, or internal instability.","During radioactive decay, an unstable atomic nucleus loses energy by radiation, causing it to disintegrate into a different, more stable atomic configuration."
characterize,verb,4,Sociology,"describe, portray",To describe the distinctive nature or features of someone or something.,"Historians often characterize the late 19th century as the 'Gilded Age,' a period of rapid economic growth but also of significant social problems and political corruption."
simulate,verb,4,Computer Science,"replicate, model","To create a model or imitation of a situation or process, often using a computer, for purposes such as study, training, or prediction.","The open-source framework was designed to simulate the fluid dynamics of airflow around an aircraft wing, providing crucial data for aerodynamic optimization."
speculate,verb,4,Astronomy,"theorize, hypothesize",To form a theory or conjecture about a subject without firm evidence.,"Astronomers speculate that the universe's accelerated expansion is driven by a mysterious force known as dark energy, though its exact nature remains one of the greatest unsolved puzzles in physics."
redundant,adjective,4,Computer Science,"superfluous, unnecessary",Not or no longer needed or useful because it is superfluous or could be omitted without loss of meaning or function.,"To ensure high availability and prevent data loss, the database architecture was designed with redundant servers that could take over immediately in case of a primary system failure."
undermine,verb,4,Sociology,"weaken, subvert","To lessen the effectiveness, power, or ability of, especially gradually or insidiously.",The proliferation of misinformation across social media platforms can seriously undermine the public's trust in established scientific institutions.
envisage,verb,4,Urban Planning,"conceive, imagine",To contemplate or conceive of a possibility or a desirable future event; to form a mental picture of something not yet existing or known.,The architects of the new sustainable city envisage a future where renewable energy sources power the entire metropolitan area.
denote,verb,4,Linguistics,"signify, indicate",To be a sign of; to indicate or mean something directly.,"In formal semantics, the term 'extension' is used to denote the set of all things in the world to which a particular word or concept refers."
offset,verb,4,Environmental Science,"counterbalance, compensate for","To counterbalance, counteract, or compensate for something, creating a net effect of zero or reducing the impact of the original item.","In many climate change mitigation strategies, the carbon emissions from industrial activities are intended to be offset by large-scale afforestation projects that absorb atmospheric CO2."
benign,adjective,4,Biology,"harmless, innocuous","Not harmful in effect; in medicine, used to describe a condition, tumor, or growth that is not cancerous.","Unlike malignant neoplasms, which are cancerous and can metastasize, benign tumors are non-invasive and typically do not pose a significant threat to the host organism."
apprehensive,adjective,4,Psychology,"anxious, uneasy",Feeling worried or anxious about something that you are going to do or that is going to happen; fearful of what may be coming.,"The graduate student was apprehensive about defending her dissertation, as the examining committee was known for its rigorous and challenging questions."
acclaim,noun,4,Arts & Literature,"praise, approbation",Enthusiastic and public praise or approval.,"Despite the widespread critical acclaim it received upon publication, the novel's complex narrative structure initially limited its commercial success."
vigorously,adverb,4,Biology,"energetically, forcefully","In a way that involves physical strength, effort, or energy; strenuously.","During the experiment, the cell culture was vigorously agitated to ensure uniform distribution of the newly introduced nutrient solution."
preliminary,adjective,4,Sociology,"introductory, preparatory",Denoting an action or event preceding or done in preparation for something fuller or more important.,The preliminary results of the ethnographic study indicate a significant correlation between social media usage and perceived social isolation among adolescents.
counteract,verb,4,Pharmacology,"neutralize, offset",To act against something in order to reduce its force or neutralize its effect.,The administration of an antagonist is a common medical strategy to counteract the effects of an overdose by blocking the drug's receptor sites.
overwhelm,verb,4,Psychology,"inundate, engulf","To give a person or a system too much of something to handle or deal with, often leading to a state of being unable to function effectively.","When the rate of information accumulation is too high, the cognitive system may be unable to process it all, and this can overwhelm the decision-making process."
acute,adjective,4,Medicine,"severe, sharp","Describing a condition, problem, or sense that is severe, intense, and often of sudden onset or short duration; also, highly developed or keen.",The study documented the acute respiratory effects of short-term exposure to high levels of urban air pollution among susceptible populations.
mandatory,adjective,4,Education,"compulsory, obligatory","Required by law, rules, or authority; compulsory and not optional.","Following the institutional review board's new guidelines, it is now mandatory for all researchers to complete a comprehensive ethics training module before initiating any study involving human subjects."
drastic,adjective,4,Environmental Science,"extreme, severe",Likely to have a strong or far-reaching effect; radical and extreme.,"The report from the climate council concluded that without drastic reductions in carbon emissions, global temperatures could rise to irreversible and catastrophic levels."
disruption,noun,4,Business,"disturbance, interruption","A disturbance or problem that interrupts an event, activity, or process, often causing a fundamental change.","The theory of disruptive innovation posits that market leaders can be overthrown by newcomers who introduce simpler, more affordable products, leading to a significant disruption of the established order."
indispensable,adjective,4,Sociology,"essential, vital",Absolutely necessary or essential; impossible to manage or live without.,"For early sociologists like Durkheim, social institutions were considered indispensable for maintaining societal order and preventing widespread anomie."
plausible,adjective,4,Archaeology,"credible, believable","(of an argument or statement) seeming reasonable or probable, and therefore potentially true.","Based on the stratigraphic evidence and the carbon dating of associated artifacts, the archaeologist presented a plausible timeline for the settlement's collapse."
analogous,adjective,4,Biology,"comparable, parallel","Comparable in certain respects, typically in a way which makes clearer the nature of the things compared.","In evolutionary biology, the wings of a bird and an insect are considered analogous structures because they serve the same function of flight but evolved independently from different ancestral origins."
viable,adjective,4,Biology,"feasible, workable","Capable of working, functioning, or developing successfully; having a reasonable chance of succeeding.","For long-term space missions, developing a closed-loop life support system that can recycle waste into viable resources like water and oxygen is a paramount engineering challenge."
consolidate,verb,4,Business,"combine, unify","To combine several things, such as organizations, debts, or resources, into a single more effective or coherent whole; to make something physically stronger or more solid.","After a series of strategic acquisitions, the multinational corporation began the complex process to consolidate its diverse operations into a more streamlined and efficient global structure."
intact,adjective,4,Archaeology,"unbroken, undamaged",Not damaged or impaired in any way; complete and in the original state.,"Despite centuries of looting, the archaeologists were astonished to find the pharaoh's innermost burial chamber completely intact, with all its treasures untouched."
conceive,verb,4,Philosophy,"imagine, devise",To form or devise a plan or idea in the mind; to imagine.,"It is difficult for the human mind to conceive of a universe with more than three spatial dimensions, yet theoretical physics requires us to do so."
deficiency,noun,4,Biology,"shortage, inadequacy",A lack or shortage of something that is necessary or required.,"A long-term deficiency of vitamin C in the diet can lead to scurvy, a disease characterized by bleeding gums and the loss of teeth."
deforestation,noun,4,Environmental Science,"forest clearing, despoliation","The permanent removal of trees to make room for something besides a forest, such as clearing the land for agriculture or grazing, or using the timber for fuel, construction, or manufacturing.","The conversion of forested areas to non-forest land for uses such as agriculture or urban development, known as deforestation, is a primary driver of habitat loss and contributes significantly to global carbon emissions."
ascribe,verb,4,History,"attribute, impute","To regard something as being caused by, possessed by, or originating from a particular person or thing.","The stability of the early Roman Empire is often ascribed to the political genius of its first emperor, Augustus, who skillfully blended republican traditions with monarchical power."
emission,noun,4,Environmental Science,"discharge, release","The production and discharge of something, especially gas or radiation.","International agreements, such as the Kyoto Protocol, have been established to compel signatory nations to reduce their anthropogenic greenhouse gas emission levels."
allegation,noun,4,Law,"claim, accusation","A claim or assertion that someone has done something illegal or wrong, typically one made without proof.","The special counsel's report meticulously detailed each allegation, assessing the credibility of the sources and the corroborating evidence available."
irreversible,adjective,4,Chemistry,"permanent, irrevocable",Not able to be undone or altered; impossible to reverse.,"In thermodynamics, an irreversible process is one that cannot return both the system and the surroundings to their original conditions once the process has been initiated."
abstract,adjective,4,Philosophy,"conceptual, theoretical",Existing in thought or as an idea but not having a physical or concrete existence.,"In philosophy, an abstract object is an object which does not exist at any particular time or place, but rather exists as a type of thing, that is, an idea or abstraction."
essence,noun,4,Philosophy,"core, quintessence","The intrinsic nature or indispensable quality of something, especially something abstract, that determines its character.","Existentialist philosophy posits that existence precedes essence, meaning that individuals first exist in the world and then must create their own values and meaning."
credibility,noun,4,Sociology,"trustworthiness, reliability",The quality of being trusted and believed in; the quality of being convincing or believable.,The meticulous methodology and transparent data analysis significantly enhanced the credibility of the research findings within the scientific community.
obsolete,adjective,4,Technology,"outdated, antiquated",No longer produced or used; out of date.,"As manufacturing processes become more automated, many traditional manual skills are rendered obsolete, forcing a significant shift in the labor market."
explicit,adjective,4,Linguistics,"clear, unambiguous","Stated clearly and in detail, leaving no room for confusion or doubt.","The theory provides an explicit framework for analyzing how grammatical structures are acquired by second-language learners, detailing each stage of development."
density,noun,4,Physics,"compactness, concentration","The degree of compactness of a substance, measured by the quantity of mass per unit volume.","In physics, density is a fundamental property of matter, defined as the ratio of an object's mass to its volume, which helps in identifying substances and understanding their physical behavior under various conditions."
suppress,verb,4,Political Science,"repress, quell","To prevent something from being expressed, seen, or from developing, often by force or authority.","The authoritarian regime took drastic measures to suppress dissent, including shutting down independent media and arresting opposition leaders."
detection,noun,4,Computer Science,"discovery, identification","The action or process of identifying the presence of something that is concealed, subtle, or not immediately obvious.",The algorithm's primary function is the real-time detection of fraudulent transactions by analyzing patterns in user spending data.
conclusive,adjective,4,Scientific Research,"decisive, definitive","Serving to prove a case; decisive or convincing, leaving no doubt.","Despite numerous studies, the evidence regarding the long-term cognitive effects of the new medication remains far from conclusive, prompting researchers to call for larger, more controlled trials."
cultivate,verb,4,Sociology,"nurture, foster","To try to acquire or develop a quality, skill, or relationship by giving it attention and effort over time.",Educational institutions play a crucial role in helping students cultivate a sense of global citizenship by exposing them to diverse cultures and perspectives.
occurrence,noun,4,Geology,"incident, event",The fact or frequency of something happening or existing.,The frequent occurrence of seismic activity along the San Andreas Fault is a direct result of the tectonic plate boundary.
presumably,adverb,4,Archaeology,"supposedly, ostensibly","Used to convey that something is very likely to be true or is a reasonable assumption, although not known for certain.","The intricate burial rituals, which involved placing valuable artifacts alongside the deceased, were presumably intended to ensure a prosperous afterlife for the individual."
invoke,verb,4,Law,"cite, appeal to","To cite or appeal to a law, authority, or principle as an authority for an action or in support of an argument.","In response to the escalating crisis, the Security Council may invoke Chapter VII of the UN Charter, which authorizes member states to use all necessary means, including military action, to restore international peace and security."
feasible,adjective,4,Engineering,"practicable, viable","Capable of being done, effected, or accomplished, especially within available means or resources; possible and practical to achieve.","While it is technically feasible to implement a fully decentralized peer-to-peer network for this purpose, the associated latency and bandwidth costs present significant practical challenges."
invaluable,adjective,4,History,"priceless, indispensable",Extremely useful; so great in value that it cannot be measured.,"The discovery of the Rosetta Stone was an invaluable breakthrough for Egyptologists, as it provided the key to deciphering ancient hieroglyphs."
superficial,adjective,4,Psychology,"shallow, cursory","Concerned only with what is obvious or on the surface; not thorough, deep, or complete.","Early theories of emotion often relied on superficial physiological indicators, such as heart rate, without delving into the complex cognitive appraisals that shape emotional experiences."
